{
  "format": "abastevo.map-distribution-v1",
  "version": 1,
  "key_id": "test-key",
  "algorithm": "Ed25519",
  "manifest": "ewogICJkZXBlbmRlbmNpZXMiOiBbCiAgICAid29ybGQiCiAgXSwKICAiZW5naW5lIjogewogICAgImZvcm1hdF92ZXJzaW9uIjogIjI2MDEiLAogICAgImdlbmVyYXRvcl9zaGEiOiAiNDU4N2I4YWQ0ZDEyYzlmNTk5ODI3MDlmZGFmMDNjYzkyNTk0ODgyNyIsCiAgICAibmFtZSI6ICJjb21hcHMiLAogICAgInVwc3RyZWFtX3NoYSI6ICI0NTg3YjhhZDRkMTJjOWY1OTk4MjcwOWZkYWYwM2NjOTI1OTQ4ODI3IgogIH0sCiAgImZvcm1hdCI6ICJhYmFzdGV2by5uYXRpdmUtbWFwLW1hbmlmZXN0LXYxIiwKICAiZ2VuZXJhdGVkX2F0IjogIjIwMjYtMTAtMjVUMTI6MDA6MDBaIiwKICAiZ2VuZXJhdGlvbiI6ICJ0ZXN0LTIwMjYxMDI1LjEiLAogICJwYWNrYWdlcyI6IFsKICAgIHsKICAgICAgImlkIjogInRlc3QtcmVjdCIsCiAgICAgICJyb2xlIjogIlJFR0lPTiIsCiAgICAgICJwYXRoIjogIjI2MDEvdGVzdC1yZWN0Lm13bSIsCiAgICAgICJieXRlcyI6IDQwOTYsCiAgICAgICJzaGEyNTYiOiAiZDQxZDQzOGMzNzkxMTBjN2Y3YjJjNTYxYjFmMDRmMjZjMWI0NTQ5MTEwNzkxZjhlMDIyZjQ4OTc0MjgwYzEzZSIKICAgIH0sCiAgICB7CiAgICAgICJpZCI6ICJ3b3JsZCIsCiAgICAgICJyb2xlIjogIk9WRVJWSUVXIiwKICAgICAgInBhdGgiOiAiMjYwMS9Xb3JsZC5td20iLAogICAgICAiYnl0ZXMiOiAyMDQ4LAogICAgICAic2hhMjU2IjogIjdjNzI3MmM5NmJkNTM5MjhkNjU5NjUwY2UwZDM1MTUzMWNjY2E1YjdjZTYxOGQxNGY0OGVjNWM4ZmZkNDkxOWYiCiAgICB9CiAgXSwKICAicmVnaW9uIjogewogICAgImJib3giOiB7CiAgICAgICJtYXhfbGF0X2RlZyI6IDEsCiAgICAgICJtYXhfbG9uX2RlZyI6IDEsCiAgICAgICJtaW5fbGF0X2RlZyI6IC0xLAogICAgICAibWluX2xvbl9kZWciOiAtMQogICAgfSwKICAgICJpZCI6ICJ0ZXN0LXJlY3QiLAogICAgIm5hbWUiOiAiU3ludGhldGljIHRlc3QgcmVjdCAobm90IGEgcmVhbCBwbGFjZSkiLAogICAgIm92ZXJ2aWV3IjogIndvcmxkIgogIH0sCiAgInJpZ2h0cyI6IHsKICAgICJhdHRyaWJ1dGlvbiI6ICJTeW50aGV0aWMgdGVzdCBjb250ZW50IiwKICAgICJjb21tZXJjaWFsIjogdHJ1ZSwKICAgICJsaWNlbnNlIjogIkNDLUJZLTQuMCIsCiAgICAib2ZmbGluZSI6IHRydWUsCiAgICAicmVkaXN0cmlidXRpb24iOiB0cnVlCiAgfSwKICAic291cmNlcyI6IFsKICAgIHsKICAgICAgImF0dHJpYnV0aW9uIjogIlN5bnRoZXRpYyB0ZXN0IGNvbnRlbnQgZ2VuZXJhdGVkIGZvciBNQVAtMTUgZml4dHVyZXMgKG5vIE9EYkwgZGF0YSkiLAogICAgICAiaWQiOiAic3ludGhldGljLXRlc3QtY29udGVudCIsCiAgICAgICJsaWNlbnNlIjogIkNDLUJZLTQuMCIsCiAgICAgICJzaGEyNTYiOiAiMDAwMDAwMDAwMDAwMDAwMDAwMDAwMDAwMDAwMDAwMDAwMDAwMDAwMDAwMDAwMDAwMDAwMDAwMDAwMDAwMDAwMCIKICAgIH0KICBdLAogICJ2ZXJzaW9uIjogMQp9",
  "manifest_sha256": "5cadb18ef5e1cfe096fbb3a236356166a7e866050c453b3bf50c76219c77eeb6",
  "signature": "_om_xwLAkrwSKnH5YOXI9ExsnCVk117-fcU8YeoZ6Vyp0X_F01sUyfW4LiB6_jxxoV1IVCUq-MZkpZtGb632AA"
}